{
  "id": "drumce-na-kopecku-2026",
  "name": "Drumce Na Kopečku",
  "year": 2026,
  "location": {
    "country": "Česká republika",
    "venueArea": "areál ČZU",
    "address": "Kamýcká 129, 165 00 Praha-Suchdol"
  },
  "description": "Třídenní open-air hudební festival zaměřený na českou hudební scénu, propojující rock, rap a mladé talenty ze středních škol, učilišť a hudebních akademií.",
  "dates": {
    "start": "2026-07-10",
    "end": "2026-07-12",
    "days": [
      {
        "date": "2026-07-10",
        "theme": "Rock Day"
      },
      {
        "date": "2026-07-11",
        "theme": "Rap Day"
      },
      {
        "date": "2026-07-12",
        "theme": "Open Mix Day"
      }
    ]
  },
  "tickets": {
    "currency": "CZK",
    "categories": [
      {
        "code": "full-pass",
        "name": "Full Festival Pass",
        "price": 1490,
        "validFrom": "2026-07-10",
        "validTo": "2026-07-12"
      },
      {
        "code": "day-pass-friday",
        "name": "Pátek / Rock Day",
        "price": 690,
        "validFrom": "2026-07-10",
        "validTo": "2026-07-10"
      },
      {
        "code": "day-pass-saturday",
        "name": "Sobota / Rap Day",
        "price": 690,
        "validFrom": "2026-07-11",
        "validTo": "2026-07-11"
      },
      {
        "code": "day-pass-sunday",
        "name": "Neděle / Open Mix Day",
        "price": 590,
        "validFrom": "2026-07-12",
        "validTo": "2026-07-12"
      }
    ]
  },
  "links": {
    "self": "/api/festival",
    "venues": "/api/venues",
    "performers": "/api/performers",
    "events": "/api/events",
    "website": "/index.html",
    "program": "/program.html",
    "info": "/prakticke_informace.html",
    "tickets": "/tickets.html"
  }
}